{
  "schema_version": "0.1.0",
  "generated_at": "2026-09-26T05:51:29Z",
  "simprep": {
    "version": "0.1.0",
    "git_commit": "096c2c213c2bb8ec6bd1c6a6ba0b1a4b6c2ecb76-dirty"
  },
  "knowledge_base": {
    "version": "0.4.0",
    "sha256": "100d86add74ae45bb20c270fecfb8ffbab8d33d897d80c1f21039ef61903ef9b"
  },
  "input": {
    "path": "tests/panel/5FQL.cif.gz",
    "sha256": "ac5ffc6fed697e7b2659f6747ad4d0638eb949220cd7ca7c8c3b372ce183f8d5",
    "format": "mmcif"
  },
  "audit_config": {
    "manifest_sha256": null,
    "regions": [],
    "severity_escalation": {
      "thresholds": [
        {
          "max_distance_angstrom": 6.0,
          "raise_levels": 2
        },
        {
          "max_distance_angstrom": 12.0,
          "raise_levels": 1
        }
      ]
    }
  },
  "structure_summary": {
    "name": "5FQL",
    "scope": "Model 1 of the deposited asymmetric unit as parsed; no biological assembly is generated and no coordinates are modified by an audit.",
    "annotation_categories_present": [
      "entity_poly_seq",
      "pdbx_struct_mod_residue",
      "pdbx_unobs_or_zero_occ_residues",
      "struct_conn"
    ],
    "annotation_categories_absent": []
  },
  "counts": [
    {
      "record_type": "polymer residues",
      "in": 507,
      "passed_through": 504,
      "flagged": 3,
      "excluded": 0
    },
    {
      "record_type": "nonpolymer residues",
      "in": 6,
      "passed_through": 0,
      "flagged": 6,
      "excluded": 0
    },
    {
      "record_type": "branched residues",
      "in": 13,
      "passed_through": 0,
      "flagged": 13,
      "excluded": 0
    },
    {
      "record_type": "water residues",
      "in": 213,
      "passed_through": 213,
      "flagged": 0,
      "excluded": 0
    },
    {
      "record_type": "atom records",
      "in": 8576,
      "passed_through": 8095,
      "flagged": 481,
      "excluded": 0
    },
    {
      "record_type": "unobserved polymer residues (annotation)",
      "in": 18,
      "passed_through": 0,
      "flagged": 18,
      "excluded": 0
    },
    {
      "record_type": "struct_conn records",
      "in": 26,
      "passed_through": 4,
      "flagged": 22,
      "excluded": 0
    },
    {
      "record_type": "pdbx_struct_mod_residue records",
      "in": 8,
      "passed_through": 0,
      "flagged": 8,
      "excluded": 0
    }
  ],
  "findings": [
    {
      "id": "metals/A:1551",
      "rule_id": "metals.calcium",
      "rule_family": "metals",
      "title": "CA site A:1551: likely_catalytic, coordination number 6",
      "base_severity": "warn",
      "effective_severity": "warn",
      "severity_context": {
        "proximity": "no_regions",
        "nearest_region": null,
        "min_distance_angstrom": null,
        "raise_levels": 0
      },
      "locus": {
        "chain": "A",
        "seq_num": 1551,
        "ins_code": "",
        "res_name": "CA",
        "atom_names": [
          "CA"
        ],
        "extent": [
          {
            "chain": "A",
            "seq_num": 1551,
            "ins_code": "",
            "res_name": "CA"
          }
        ]
      },
      "anchor_residues": [
        {
          "chain": "A",
          "seq_num": 1551,
          "ins_code": ""
        }
      ],
      "evidence": [
        {
          "key": "metal_occupancy",
          "type": "occupancy",
          "value": 1.0
        },
        {
          "key": "metal_b_factor",
          "type": "b_factor",
          "value": 54.96,
          "unit": "angstrom_squared"
        },
        {
          "key": "coordination_cutoff",
          "type": "number",
          "value": 3.0,
          "unit": "angstrom"
        },
        {
          "key": "min_donor_occupancy",
          "type": "number",
          "value": 0.5,
          "unit": "fraction"
        },
        {
          "key": "coordination_number",
          "type": "count",
          "value": 6
        },
        {
          "key": "protein_donors",
          "type": "count",
          "value": 4
        },
        {
          "key": "water_donors",
          "type": "count",
          "value": 0
        },
        {
          "key": "nonstandard_polymer_residue_donors",
          "type": "count",
          "value": 2
        },
        {
          "key": "nonpolymer_ligand_donors",
          "type": "count",
          "value": 0
        },
        {
          "key": "mean_ligand_distance",
          "type": "number",
          "value": 2.346,
          "unit": "angstrom"
        },
        {
          "key": "geometry",
          "type": "label",
          "value": "octahedral"
        },
        {
          "key": "geometry_rms_angle_deviation",
          "type": "number",
          "value": 20.509,
          "unit": "degree"
        },
        {
          "key": "classification",
          "type": "label",
          "value": "likely_catalytic",
          "note": "shell contains nonstandard_polymer_residue"
        },
        {
          "key": "ligand_distance",
          "type": "distance",
          "value": 2.293,
          "unit": "angstrom",
          "atoms": [
            {
              "chain": "A",
              "seq_num": 1551,
              "ins_code": "",
              "res_name": "CA",
              "atom_name": "CA",
              "altloc": ""
            },
            {
              "chain": "A",
              "seq_num": 335,
              "ins_code": "",
              "res_name": "HIS",
              "atom_name": "NE2",
              "altloc": ""
            }
          ],
          "note": "protein"
        },
        {
          "key": "ligand_distance",
          "type": "distance",
          "value": 2.295,
          "unit": "angstrom",
          "atoms": [
            {
              "chain": "A",
              "seq_num": 1551,
              "ins_code": "",
              "res_name": "CA",
              "atom_name": "CA",
              "altloc": ""
            },
            {
              "chain": "A",
              "seq_num": 46,
              "ins_code": "",
              "res_name": "ASP",
              "atom_name": "OD1",
              "altloc": ""
            }
          ],
          "note": "protein"
        },
        {
          "key": "ligand_distance",
          "type": "distance",
          "value": 2.323,
          "unit": "angstrom",
          "atoms": [
            {
              "chain": "A",
              "seq_num": 1551,
              "ins_code": "",
              "res_name": "CA",
              "atom_name": "CA",
              "altloc": ""
            },
            {
              "chain": "A",
              "seq_num": 84,
              "ins_code": "",
              "res_name": "ALS",
              "atom_name": "OS1",
              "altloc": ""
            }
          ],
          "note": "nonstandard_polymer_residue"
        },
        {
          "key": "ligand_distance",
          "type": "distance",
          "value": 2.324,
          "unit": "angstrom",
          "atoms": [
            {
              "chain": "A",
              "seq_num": 1551,
              "ins_code": "",
              "res_name": "CA",
              "atom_name": "CA",
              "altloc": ""
            },
            {
              "chain": "A",
              "seq_num": 334,
              "ins_code": "",
              "res_name": "ASP",
              "atom_name": "OD2",
              "altloc": ""
            }
          ],
          "note": "protein"
        },
        {
          "key": "ligand_distance",
          "type": "distance",
          "value": 2.374,
          "unit": "angstrom",
          "atoms": [
            {
              "chain": "A",
              "seq_num": 1551,
              "ins_code": "",
              "res_name": "CA",
              "atom_name": "CA",
              "altloc": ""
            },
            {
              "chain": "A",
              "seq_num": 45,
              "ins_code": "",
              "res_name": "ASP",
              "atom_name": "OD1",
              "altloc": ""
            }
          ],
          "note": "protein"
        },
        {
          "key": "ligand_distance",
          "type": "distance",
          "value": 2.47,
          "unit": "angstrom",
          "atoms": [
            {
              "chain": "A",
              "seq_num": 1551,
              "ins_code": "",
              "res_name": "CA",
              "atom_name": "CA",
              "altloc": ""
            },
            {
              "chain": "A",
              "seq_num": 84,
              "ins_code": "",
              "res_name": "ALS",
              "atom_name": "OS4",
              "altloc": ""
            }
          ],
          "note": "nonstandard_polymer_residue"
        },
        {
          "key": "annotated_metal_link",
          "type": "source_record",
          "category": "struct_conn",
          "fields": {
            "id": "metalc1",
            "conn_type": "metalc",
            "distance_angstrom": 2.374
          },
          "atoms": [
            {
              "chain": "A",
              "seq_num": 45,
              "ins_code": "",
              "res_name": "ASP",
              "atom_name": "OD1",
              "altloc": ""
            },
            {
              "chain": "A",
              "seq_num": 1551,
              "ins_code": "",
              "res_name": "CA",
              "atom_name": "CA",
              "altloc": ""
            }
          ]
        },
        {
          "key": "annotated_metal_link",
          "type": "source_record",
          "category": "struct_conn",
          "fields": {
            "id": "metalc2",
            "conn_type": "metalc",
            "distance_angstrom": 2.295
          },
          "atoms": [
            {
              "chain": "A",
              "seq_num": 46,
              "ins_code": "",
              "res_name": "ASP",
              "atom_name": "OD1",
              "altloc": ""
            },
            {